question,references,corpus_id,corpus_id_path
What role did Regehr assume in NHLPA following the lockout?,"[{""content"": ""He was also critical of the position of the league in the lockout , and took on a greater role within the National Hockey League Players Association ( NHLPA ) when he succeeded Jarome Iginla as the Flames player representative following the lockout "", ""start_index"": 89758, ""end_index"": 90007}]",wikitext_1103,assets/corpora_public/2024-11-30_01-47-25/wikitext_1103.txt
Which Grammy category did the track 'War Machine' from Black Ice win?,"[{""content"": ""The track \"" War Machine \"" won the Best Hard Rock Performance category at the Grammys "", ""start_index"": 89217, ""end_index"": 89302}]",wikitext_5158,assets/corpora_public/2024-11-30_01-47-25/wikitext_5158.txt
What are the geographic names of the main islands in the Northern Isles?,"[{""content"": "" The phrase \"" Northern Isles \"" generally refers to the main islands of the Orkney and Shetland archipelagos "", ""start_index"": 61781, ""end_index"": 61889}]",wikitext_5158,assets/corpora_public/2024-11-30_01-47-25/wikitext_5158.txt
What were the outcomes of the German High Seas Fleet at Scapa Flow after World War I?,"[{""content"": ""After the Armistice in 1918 , the German High Seas Fleet was transferred in its entirety to Scapa Flow while a decision was to be made on its future ; however , the German sailors opened their sea @-@ cocks and scuttled all the ships "", ""start_index"": 74717, ""end_index"": 74951}]",wikitext_5158,assets/corpora_public/2024-11-30_01-47-25/wikitext_5158.txt
What were the Billboard ratings for 'Lovesick Blues' as reviewed by different groups?,"[{""content"": ""Based on votes sent to Billboard , the record was rated with 85 points by disc jockeys , 82 by record dealers and 85 by jukebox operators "", ""start_index"": 56027, ""end_index"": 56165}]",wikitext_5158,assets/corpora_public/2024-11-30_01-47-25/wikitext_5158.txt
What are the requirements for a warrant to be considered reasonable under the Fourth Amendment?,"[{""content"": ""\"" In order for such a warrant to be considered reasonable , it must be supported by probable cause and be limited in scope according to specific information supplied by a person ( usually a law enforcement officer ) who has sworn by it and is therefore accountable to the issuing court "", ""start_index"": 83215, ""end_index"": 83501}]",wikitext_4382,assets/corpora_public/2024-11-30_01-47-25/wikitext_4382.txt
What are the central issues addressed in Fourth Amendment case law?,"[{""content"": ""Fourth Amendment case law deals with three central issues : what government activities constitute \"" search \"" and \"" seizure \"" ; what constitutes probable cause for these actions ; how violations of Fourth Amendment rights should be addressed "", ""start_index"": 82038, ""end_index"": 82279}]",wikitext_4382,assets/corpora_public/2024-11-30_01-47-25/wikitext_4382.txt
What are the three central issues addressed by Fourth Amendment case law?,"[{""content"": ""Fourth Amendment case law deals with three central issues : what government activities constitute \"" search \"" and \"" seizure \"" ; what constitutes probable cause for these actions ; how violations of Fourth Amendment rights should be addressed "", ""start_index"": 82038, ""end_index"": 82279}]",wikitext_4382,assets/corpora_public/2024-11-30_01-47-25/wikitext_4382.txt
What led to Zajączek's promotion to lieutenant general?,"[{""content"": ""On 6 April he was promoted to lieutenant general"", ""start_index"": 6165, ""end_index"": 6213}]",wikitext_4382,assets/corpora_public/2024-11-30_01-47-25/wikitext_4382.txt
What were the prerequisites for the U.S. Constitution's ratification?,"[{""content"": ""For the constitution to be ratified , however , nine of the thirteen states were required to approve it in state conventions "", ""start_index"": 77689, ""end_index"": 77814}]",wikitext_4382,assets/corpora_public/2024-11-30_01-47-25/wikitext_4382.txt
What were the causes of Zajączek being criticized during his tenure as namestnik?,"[{""content"": ""He has been criticized , however , for being inexperienced for such a major civil leader position , too servile to the wishes of his patron , Grand Duke Constantine Pavlovich and he often disregarded the Constitution of the Congress Poland , which contributed to a slow but steady erosion of the country 's freedoms and autonomy "", ""start_index"": 12046, ""end_index"": 12375}]",wikitext_4382,assets/corpora_public/2024-11-30_01-47-25/wikitext_4382.txt
